{
  "format": "tsa.benchmark/1",
  "id": "RDM-03",
  "title": "Poutre sur deux appuis — charge uniforme",
  "category": "rdm",
  "description": "Poutre isostatique de 6 m (deux barres de 3 m, nœud à mi-portée), q = 10 kN/m.",
  "sources": [
    "S. Timoshenko, J. Gere — Mechanics of Materials (poutres d'Euler-Bernoulli, formules usuelles de RDM)",
    "W.C. Young, R.G. Budynas — Roark's Formulas for Stress and Strain, 7e éd. (tableaux des poutres, torsion)"
  ],
  "hypotheses": [
    "Euler-Bernoulli (cisaillement négligé)",
    "modèle plan (XZ) calculé en 3D : Ty et Rx bloqués aux appuis (aucun mécanisme hors plan), Rz libre"
  ],
  "units": {
    "force": "kN",
    "length": "m",
    "stress": "kPa"
  },
  "engines": [
    "opensees",
    "custom2d"
  ],
  "parameters": {
    "E": 210000000.0,
    "nu": 0.3,
    "b": 0.2,
    "h": 0.4,
    "A": "b*h",
    "I": "b*h^3/12",
    "W": "b*h^2/6",
    "L": 6.0,
    "q": 10.0
  },
  "model": {
    "materials": {
      "S": {
        "E": 210000000.0,
        "nu": 0.3,
        "rho": 7850
      }
    },
    "sections": {
      "R": {
        "shape": "rectangular",
        "b": 0.2,
        "h": 0.4
      }
    },
    "nodes": [
      {
        "id": 1,
        "x": 0.0,
        "y": 0,
        "z": 0,
        "support": [
          1,
          1,
          1,
          1,
          0,
          0
        ]
      },
      {
        "id": 2,
        "x": 3.0,
        "y": 0,
        "z": 0
      },
      {
        "id": 3,
        "x": 6.0,
        "y": 0,
        "z": 0,
        "support": [
          0,
          1,
          1,
          1,
          0,
          0
        ]
      }
    ],
    "members": [
      {
        "id": 1,
        "type": "beam",
        "i": 1,
        "j": 2,
        "section": "R",
        "material": "S"
      },
      {
        "id": 2,
        "type": "beam",
        "i": 2,
        "j": 3,
        "section": "R",
        "material": "S"
      }
    ],
    "cases": [
      {
        "id": 1,
        "name": "q"
      }
    ],
    "memberLoads": [
      {
        "member": 1,
        "case": 1,
        "type": "uniform",
        "q": 10.0,
        "direction": "gravity"
      },
      {
        "member": 2,
        "case": 1,
        "type": "uniform",
        "q": 10.0,
        "direction": "gravity"
      }
    ]
  },
  "analysis": {
    "selfWeight": false,
    "case": 1
  },
  "checks": [
    {
      "quantity": "node:2:uz",
      "label": "flèche à mi-portée",
      "expected": "-5*q*L^4/(384*E*I)",
      "unit": "m",
      "tolerance": {
        "rel": 1e-06,
        "abs": 1e-09
      }
    },
    {
      "quantity": "reaction:1:fz",
      "label": "réaction gauche",
      "expected": "q*L/2",
      "unit": "kN",
      "tolerance": {
        "rel": 1e-06,
        "abs": 1e-09
      }
    },
    {
      "quantity": "reaction:3:fz",
      "label": "réaction droite",
      "expected": "q*L/2",
      "unit": "kN",
      "tolerance": {
        "rel": 1e-06,
        "abs": 1e-09
      }
    },
    {
      "quantity": "member:1:M:absmax",
      "label": "moment maximal",
      "expected": "q*L^2/8",
      "unit": "kN·m",
      "tolerance": {
        "rel": 1e-06,
        "abs": 1e-09
      }
    },
    {
      "quantity": "member:1:V:absmax",
      "label": "effort tranchant d'appui",
      "expected": "q*L/2",
      "unit": "kN",
      "tolerance": {
        "rel": 1e-06,
        "abs": 1e-09
      }
    },
    {
      "quantity": "node:1:ry",
      "label": "rotation d'appui",
      "expected": "q*L^3/(24*E*I)",
      "unit": "rad",
      "tolerance": {
        "rel": 1e-06,
        "abs": 1e-09
      }
    }
  ]
}
