{
  "format": "tsa.benchmark/1",
  "id": "FEA-01",
  "title": "Plaque carrée simplement appuyée — quadrangles ShellMITC4",
  "category": "fea",
  "description": "Plaque 6 × 6 m, e = 0,20 m, q = 10 kN/m², appuis simples sur les 4 bords : w = 0,00406·q·a⁴/D (Navier). Étude de convergence sur trois maillages.",
  "sources": [
    "N. Ugural — Plates and Shells: Theory and Analysis (plaque rectangulaire simplement appuyée, solution de Navier)",
    "OpenSees — ShellMITC4 (Dvorkin-Bathe) et ShellDKGT : documentation et exemples de vérification (opensees.berkeley.edu)"
  ],
  "hypotheses": [
    "coque élastique linéaire, plaque mince (a/e = 30)",
    "appui simple : translations du bord bloquées, rotations libres (appui « mou » au sens de Mindlin)",
    "référence de Kirchhoff : MITC4 (Mindlin) converge vers une solution plus souple, à cause de la couche limite de l'appui mou (écart croissant au raffinement, 2,65 % à h = 0,25 m) ; la convergence de MITC4 est vérifiée contre la référence de Mindlin par FEA-07 (appui dur)"
  ],
  "units": {
    "force": "kN",
    "length": "m",
    "stress": "kPa"
  },
  "engines": [
    "opensees"
  ],
  "parameters": {
    "E": 31000000.0,
    "nu": 0.2,
    "e": 0.2,
    "a": 6.0,
    "q": 10.0,
    "D": "E*e^3/(12*(1-nu^2))"
  },
  "model": {
    "materials": {
      "C": {
        "E": 31000000.0,
        "nu": 0.2,
        "rho": 2500
      }
    },
    "sections": {},
    "nodes": [
      {
        "id": 1,
        "x": 0,
        "y": 0,
        "z": 0
      },
      {
        "id": 2,
        "x": 6,
        "y": 0,
        "z": 0
      },
      {
        "id": 3,
        "x": 6,
        "y": 6,
        "z": 0
      },
      {
        "id": 4,
        "x": 0,
        "y": 6,
        "z": 0
      }
    ],
    "members": [],
    "slabs": [
      {
        "id": 1,
        "nodes": [
          1,
          2,
          3,
          4
        ],
        "thickness": 0.2,
        "material": "C",
        "edgeSupports": [
          {
            "edge": -1,
            "fixed": [
              1,
              1,
              1,
              0,
              0,
              0
            ]
          }
        ]
      }
    ],
    "cases": [
      {
        "id": 1,
        "name": "q"
      }
    ],
    "surfaceLoads": [
      {
        "slab": 1,
        "case": 1,
        "q": 10.0
      }
    ]
  },
  "analysis": {
    "selfWeight": false,
    "case": 1,
    "meshSizes": [
      1.0,
      0.5,
      0.25
    ],
    "quads": true
  },
  "checks": [
    {
      "quantity": "surface:uz:absmax",
      "label": "flèche au centre (vers le bas)",
      "expected": "-0.00406*q*a^4/D",
      "unit": "m",
      "tolerance": {
        "rel": 0.05,
        "abs": 1e-09
      }
    },
    {
      "quantity": "reactionsum:fz",
      "label": "Σ réactions = q·a²",
      "expected": "q*a^2",
      "unit": "kN",
      "tolerance": {
        "rel": 1e-06,
        "abs": 1e-09
      }
    }
  ]
}
