{
  "format": "tsa.benchmark/1",
  "id": "FEA-04",
  "title": "Dalle avec trémie — équilibre et aire nette",
  "category": "fea",
  "description": "Dalle 6 × 4 m appuyée sur son contour, trémie 1,5 × 1,2 m, q = 5 kN/m² et poids propre : Σ R = (q + ρ·g·e)·(A − A_trémie).",
  "sources": [
    "OpenSees — ShellMITC4 (Dvorkin-Bathe) et ShellDKGT : documentation et exemples de vérification (opensees.berkeley.edu)"
  ],
  "hypotheses": [
    "charges nodales cohérentes, ouverture déduite"
  ],
  "units": {
    "force": "kN",
    "length": "m",
    "stress": "kPa"
  },
  "engines": [
    "opensees"
  ],
  "parameters": {
    "q": 5.0,
    "g": "2500*9.81*0.2/1000",
    "An": "6*4 - 1.5*1.2"
  },
  "model": {
    "materials": {
      "C": {
        "E": 31000000.0,
        "nu": 0.2,
        "rho": 2500
      }
    },
    "sections": {},
    "nodes": [
      {
        "id": 1,
        "x": 0,
        "y": 0,
        "z": 0
      },
      {
        "id": 2,
        "x": 6,
        "y": 0,
        "z": 0
      },
      {
        "id": 3,
        "x": 6,
        "y": 4,
        "z": 0
      },
      {
        "id": 4,
        "x": 0,
        "y": 4,
        "z": 0
      }
    ],
    "members": [],
    "slabs": [
      {
        "id": 1,
        "nodes": [
          1,
          2,
          3,
          4
        ],
        "thickness": 0.2,
        "material": "C",
        "edgeSupports": [
          {
            "edge": -1,
            "fixed": [
              1,
              1,
              1,
              0,
              0,
              0
            ]
          }
        ],
        "openings": [
          [
            [
              2,
              1
            ],
            [
              3.5,
              1
            ],
            [
              3.5,
              2.2
            ],
            [
              2,
              2.2
            ]
          ]
        ]
      }
    ],
    "cases": [
      {
        "id": 1,
        "name": "q"
      }
    ],
    "surfaceLoads": [
      {
        "slab": 1,
        "case": 1,
        "q": 5.0
      }
    ]
  },
  "analysis": {
    "selfWeight": true,
    "case": 1,
    "meshSize": 0.4,
    "quads": true
  },
  "checks": [
    {
      "quantity": "reactionsum:fz",
      "label": "Σ réactions",
      "expected": "(q+g)*An",
      "unit": "kN",
      "tolerance": {
        "rel": 1e-06,
        "abs": 1e-09
      }
    }
  ]
}
