{
 "format": "tsa.benchmark/1",
 "id": "NLIN-control-lineaire",
 "title": "Témoin : même poutre en statique linéaire",
 "category": "rdm",
 "description": "Témoin : même poutre en statique linéaire",
 "sources": [
  "RDM"
 ],
 "hypotheses": [
  "géométrie linéaire"
 ],
 "units": {
  "force": "kN",
  "length": "m",
  "stress": "kPa"
 },
 "engines": [
  "opensees"
 ],
 "parameters": {
  "L": 6.0,
  "q": 12.0
 },
 "model": {
  "materials": {
   "S": {
    "E": 210000000.0,
    "nu": 0.3,
    "rho": 7850
   }
  },
  "sections": {
   "R": {
    "shape": "rectangular",
    "b": 0.2,
    "h": 0.4
   }
  },
  "nodes": [
   {
    "id": 1,
    "x": 0,
    "y": 0,
    "z": 0,
    "support": [
     1,
     1,
     1,
     1,
     0,
     1
    ]
   },
   {
    "id": 2,
    "x": 6.0,
    "y": 0,
    "z": 0,
    "support": [
     0,
     1,
     1,
     1,
     0,
     1
    ]
   }
  ],
  "members": [
   {
    "id": 1,
    "i": 1,
    "j": 2,
    "section": "R",
    "material": "S"
   }
  ],
  "cases": [
   {
    "id": 1,
    "name": "Q"
   }
  ],
  "memberLoads": [
   {
    "member": 1,
    "type": "uniform",
    "case": 1,
    "q": -12.0,
    "direction": "globalZ"
   }
  ]
 },
 "analysis": {
  "case": 1,
  "selfWeight": false,
  "type": "linear_static",
  "engineSettings": {
   "opensees": {}
  }
 },
 "checks": [
  {
   "quantity": "reaction:1:fz",
   "label": "R",
   "expected": "q*L/2",
   "unit": "kN",
   "tolerance": {
    "rel": 1e-06,
    "abs": 1e-09
   }
  },
  {
   "quantity": "member:1:M:absmax",
   "label": "M max le long de la barre",
   "expected": "q*L^2/8",
   "unit": "kN·m",
   "tolerance": {
    "rel": 0.001,
    "abs": 0.001
   }
  },
  {
   "quantity": "member:1:M:at=0.5",
   "label": "M à mi-portée",
   "expected": "q*L^2/8",
   "unit": "kN·m",
   "tolerance": {
    "rel": 0.001,
    "abs": 0.001
   }
  }
 ]
}