{
  "format": "tsa.benchmark/1",
  "id": "RDM-09",
  "title": "Flexion composée — console",
  "category": "rdm",
  "description": "Console de 3 m, N = 200 kN (traction) et F = 10 kN en bout : σ_max = N/A + F·L/W à l'encastrement (théorie linéaire, sans effet du second ordre).",
  "sources": [
    "S. Timoshenko, J. Gere — Mechanics of Materials (poutres d'Euler-Bernoulli, formules usuelles de RDM)"
  ],
  "hypotheses": [
    "superposition (premier ordre)",
    "section rectangulaire : W = b·h²/6"
  ],
  "units": {
    "force": "kN",
    "length": "m",
    "stress": "kPa"
  },
  "engines": [
    "opensees",
    "custom2d"
  ],
  "parameters": {
    "E": 210000000.0,
    "nu": 0.3,
    "b": 0.2,
    "h": 0.4,
    "A": "b*h",
    "I": "b*h^3/12",
    "W": "b*h^2/6",
    "L": 3.0,
    "N": 200.0,
    "F": 10.0
  },
  "model": {
    "materials": {
      "S": {
        "E": 210000000.0,
        "nu": 0.3,
        "rho": 7850
      }
    },
    "sections": {
      "R": {
        "shape": "rectangular",
        "b": 0.2,
        "h": 0.4
      }
    },
    "nodes": [
      {
        "id": 1,
        "x": 0.0,
        "y": 0,
        "z": 0,
        "support": [
          1,
          1,
          1,
          1,
          1,
          1
        ]
      },
      {
        "id": 2,
        "x": 3.0,
        "y": 0,
        "z": 0,
        "support": [
          0,
          1,
          0,
          1,
          0,
          1
        ]
      }
    ],
    "members": [
      {
        "id": 1,
        "type": "beam",
        "i": 1,
        "j": 2,
        "section": "R",
        "material": "S"
      }
    ],
    "cases": [
      {
        "id": 1,
        "name": "NM"
      }
    ],
    "nodalLoads": [
      {
        "node": 2,
        "case": 1,
        "fx": 200.0,
        "fz": -10.0
      }
    ]
  },
  "analysis": {
    "selfWeight": false,
    "case": 1
  },
  "checks": [
    {
      "quantity": "member:1:sigma:absmax",
      "label": "contrainte normale maximale",
      "expected": "N/A + F*L/W",
      "unit": "kPa",
      "tolerance": {
        "rel": 1e-06,
        "abs": 1e-09
      }
    },
    {
      "quantity": "member:1:N:start",
      "label": "effort normal",
      "expected": "N",
      "unit": "kN",
      "tolerance": {
        "rel": 1e-06,
        "abs": 1e-09
      }
    },
    {
      "quantity": "member:1:M:absmax",
      "label": "moment à l'encastrement",
      "expected": "F*L",
      "unit": "kN·m",
      "tolerance": {
        "rel": 1e-06,
        "abs": 1e-09
      }
    }
  ]
}
